{
  "title": "支付模块测试执行报告",
  "generated_at": "2026-07-15T09:00:00.000Z",
  "skill_invocation": {
    "primary": "single-api-test-full",
    "secondary": "production-verification-test",
    "roles": "生成接口用例并补充生产只读验证"
  },
  "sheets": [
    {
      "name": "用例",
      "kind": "test_cases",
      "columns": [
        "用例 ID",
        "所属模块",
        "用例标题",
        "验证功能点",
        "前置条件",
        "测试步骤",
        "预期结果",
        "优先级",
        "执行结果",
        "备注"
      ],
      "rows": [
        {
          "divider": true,
          "values": ["【模块分割行】", "第 1 模块：支付", "支付主流程", "-", "-", "-", "-", "-", "-", "模块起始分割"]
        },
        {
          "values": ["PAY-001", "支付", "【正向】正常支付", "验证支付成功", "测试账号已登录", "1. 提交合法订单\n2. 完成支付", "1. 返回成功\n2. 订单状态已支付", "P0", "未执行", ""]
        },
        {
          "values": ["PAY-002", "支付", "【异常】余额不足", "验证失败提示", "余额不足", "提交支付", "明确提示余额不足且不扣款", "P0", "通过", "已验证"]
        },
        {
          "values": ["PAY-003", "退款", "【异常】重复退款", "验证幂等", "订单已退款", "再次发起退款", "不重复退款", "P1", "不通过", "关联 BUG-101"]
        },
        {
          "values": ["PAY-004", "退款", "【口径】退款时效", "验证时效口径", "订单已支付", "超过时效后退款", "按最终确认口径判定", "P2", "待定", ""]
        }
      ]
    },
    {
      "name": "说明",
      "kind": "supplementary",
      "columns": ["项目", "内容"],
      "rows": [
        { "values": ["状态", "未执行 / 通过 / 不通过 / 待定"] }
      ]
    }
  ]
}
