{
  "title": "支付模块测试执行报告",
  "project": "示例项目/支付模块",
  "generated_at": "2026-07-13T08:00:00Z",
  "skill_invocation": {
    "primary": "single-api-test-full",
    "secondary": "无",
    "roles": "主 Skill 完成接口分析与正式用例生成"
  },
  "sheets": [
    {
      "name": "执行总览",
      "kind": "overview",
      "columns": ["项目", "内容"],
      "rows": [
        {"values": ["报告", "支付模块测试执行报告"]},
        {"values": ["状态", "未执行 / 通过 / 不通过 / 待定"]}
      ]
    },
    {
      "name": "支付用例",
      "kind": "test_cases",
      "columns": ["用例 ID", "所属模块", "用例标题", "验证功能点", "前置条件", "测试步骤", "预期结果", "优先级", "执行结果", "备注"],
      "rows": [
        {"divider": true, "values": ["【模块分割行】", "第 1 模块：支付", "支付主流程与异常", "-", "-", "-", "-", "-", "-", "模块起始分割"]},
        {"values": ["PAY-001", "支付", "【正向】正常支付", "1. 验证支付成功", "1. 测试账号已登录", "1. 提交合法订单\n2. 完成支付", "1. 返回成功\n2. 订单状态已支付", "P0", "未执行", ""]},
        {"values": ["PAY-002", "支付", "【异常】余额不足", "1. 验证失败提示", "1. 余额不足", "1. 提交支付", "1. 明确提示余额不足\n2. 不扣款", "P0", "通过", ""]},
        {"values": ["PAY-003", "退款", "【异常】重复退款", "1. 验证幂等", "1. 已退款订单", "1. 再次发起退款", "1. 不重复退款", "P1", "不通过", "关联 BUG-101"]},
        {"values": ["PAY-004", "退款", "【口径】退款时效歧义", "1. 验证时效口径", "1. 已支付订单", "1. 超过不同口径时效后退款", "1. 按最终确认口径判定", "P2", "待定", ""]}
      ]
    },
    {
      "name": "风险补充",
      "kind": "supplementary",
      "columns": ["风险", "说明"],
      "rows": [{"values": ["口径歧义", "退款时效需要产品、研发和测试共同确认"]}]
    }
  ]
}
